{"$id":"https://moving-origin-research.invalid/schemas/m4-model-qualification-report-v1","$schema":"https://json-schema.org/draft/2020-12/schema","$defs":{"failure":{"additionalProperties":false,"properties":{"code":{"enum":["CONFIGURATION_MISMATCH","BATTERY_UNBOUND","Q2_UNSIGNED","Q1_FAIL","Q2_FLOOR","Q2_CEILING","Q3_FAIL","PREFLIGHT_FAIL"]},"detail":{"type":"string"},"ordinal":{"minimum":0,"type":"integer"},"stage_id":{"type":"string"}},"required":["ordinal","stage_id","code","detail"],"type":"object"},"stage":{"additionalProperties":false,"properties":{"battery":{"enum":["STANDARD","HARDER"]},"failure_code":{"type":["string","null"]},"gate":{"enum":["Q1_FORMAT","Q2_INFORMATIVE_BAND","Q3_MIRROR_CALIBRATABILITY"]},"ordinal":{"minimum":0,"type":"integer"},"rung_id":{"enum":["PRIMARY_QWEN3_4B_FP8","FALLBACK_QWEN3_8B_FP8"]},"status":{"enum":["PASS","FAIL","NOT_RUN"]}},"required":["ordinal","rung_id","battery","gate","status","failure_code"],"type":"object"}},"additionalProperties":false,"properties":{"attempted_stages":{"items":{"$ref":"#/$defs/stage"},"type":"array"},"battery_manifest_sha256":{"pattern":"^[0-9a-f]{64}$"},"date":{"const":"2026-08-21"},"failures":{"items":{"$ref":"#/$defs/failure"},"type":"array"},"nonadaptive_attestation":{"const":true},"plan_sha256":{"pattern":"^[0-9a-f]{64}$"},"preflight_result_sha256":{"pattern":"^[0-9a-f]{64}$"},"regime":{"const":"B"},"schema_version":{"const":"m4-model-qualification-report-v1"},"selected_rung":{"anyOf":[{"enum":["PRIMARY_QWEN3_4B_FP8","FALLBACK_QWEN3_8B_FP8"]},{"type":"null"}]},"serving_mode":{"enum":["CO_RESIDENT","PHASED_SEQUENTIAL","NONE"]},"status":{"enum":["PRIMARY_SELECTED","FALLBACK_SELECTED","NO_QUALIFYING_RUNG","BLOCKED"]}},"required":["schema_version","date","regime","plan_sha256","battery_manifest_sha256","preflight_result_sha256","status","selected_rung","serving_mode","attempted_stages","failures","nonadaptive_attestation"],"title":"M4 model qualification report v1","type":"object","x-artifact-date":"2026-08-21","x-artifact-regime":"B","x-source-class":"PROPOSED"}
