{"attempted_stages":[{"battery":"STANDARD","failure_code":null,"gate":"Q1_FORMAT","ordinal":0,"rung_id":"PRIMARY_QWEN3_4B_FP8","status":"PASS"},{"battery":"STANDARD","failure_code":null,"gate":"Q2_INFORMATIVE_BAND","ordinal":1,"rung_id":"PRIMARY_QWEN3_4B_FP8","status":"PASS"},{"battery":"STANDARD","failure_code":null,"gate":"Q3_MIRROR_CALIBRATABILITY","ordinal":2,"rung_id":"PRIMARY_QWEN3_4B_FP8","status":"PASS"}],"battery_manifest_sha256":"0000000000000000000000000000000000000000000000000000000000000000","date":"2026-08-21","failures":[],"nonadaptive_attestation":true,"plan_sha256":"0000000000000000000000000000000000000000000000000000000000000000","preflight_result_sha256":"0000000000000000000000000000000000000000000000000000000000000000","regime":"B","schema_version":"m4-model-qualification-report-v1","selected_rung":"PRIMARY_QWEN3_4B_FP8","serving_mode":"CO_RESIDENT","status":"PRIMARY_SELECTED"}
