{"attempted_stages":[],"battery_manifest_sha256":"0000000000000000000000000000000000000000000000000000000000000000","date":"2026-08-21","failures":[{"code":"BATTERY_UNBOUND","detail":"standard and harder battery identities are not Rebecca-released","ordinal":0,"stage_id":"PRESTART"}],"nonadaptive_attestation":true,"plan_sha256":"0000000000000000000000000000000000000000000000000000000000000000","preflight_result_sha256":"0000000000000000000000000000000000000000000000000000000000000000","regime":"B","schema_version":"m4-model-qualification-report-v1","selected_rung":null,"serving_mode":"NONE","status":"BLOCKED"}
